{"$schema":"https://json-schema.org/draft/2020-12/schema","type":"object","required":["id","frameworkId","type","title","description","packageIds","symbolIds","componentIds","documentSectionIds","exampleIds","prerequisiteTopicIds","priority","learningStatus","sourceCommit","catalogRootHash","symbolRootHash","coverageTargets","warnings"],"properties":{"id":{"type":"string","pattern":"^[a-z0-9][a-z0-9-]*$"},"frameworkId":{"type":"string"},"type":{"enum":["framework_concept","package","component","event_system","lifecycle","styling","development_workflow","build_workflow","troubleshooting","version_change"]},"title":{"type":"string","maxLength":300},"description":{"type":"string","maxLength":2000},"packageIds":{"type":"array","items":{"type":"string"}},"symbolIds":{"type":"array","items":{"type":"string"}},"componentIds":{"type":"array","items":{"type":"string"}},"documentSectionIds":{"type":"array","items":{"type":"string"}},"exampleIds":{"type":"array","items":{"type":"string"}},"prerequisiteTopicIds":{"type":"array","items":{"type":"string"}},"priority":{"type":"integer"},"learningStatus":{"enum":["planned","bundled","handed_off","draft_imported","validated","reviewed","published","superseded","blocked"]},"sourceCommit":{"type":"string","pattern":"^[a-f0-9]{40}$"},"catalogRootHash":{"type":"string","pattern":"^sha256:[a-f0-9]{64}$"},"symbolRootHash":{"type":"string","pattern":"^sha256:[a-f0-9]{64}$"},"coverageTargets":{"type":"array","items":{"type":"string"}},"warnings":{"type":"array","items":{"type":"string"}}}}
