{
  "id": "ncinput-events",
  "frameworkId": "ncom",
  "type": "component",
  "title": "NCInput API and value change event",
  "description": "Learn NCInput API and public value-change usage.",
  "packageIds": [],
  "symbolIds": [
    "symbol-a99fecb6fdc985b4"
  ],
  "componentIds": [
    "component-79de77ea33744632"
  ],
  "documentSectionIds": [],
  "exampleIds": [],
  "prerequisiteTopicIds": [
    "component-base-model"
  ],
  "priority": 93,
  "learningStatus": "published",
  "sourceCommit": "a350b576bbeae6c6254273037a17d2a8730fb80f",
  "catalogRootHash": "sha256:0dbfa378eedaaef0b31867b679e7932157eb63bb0cc4e3fa0fb0a0d1869c6518",
  "symbolRootHash": "sha256:52e4461d185ce375263aca5e412b2d93f402d906867bf0940bffc9807eec6297",
  "coverageTargets": [
    "component",
    "event"
  ],
  "warnings": []
}
