{
  "id": "event-system",
  "frameworkId": "ncom",
  "type": "event_system",
  "title": "NCom event system",
  "description": "Learn observable component event facts.",
  "packageIds": [],
  "symbolIds": [
    "symbol-4ef0a65933001699"
  ],
  "componentIds": [],
  "documentSectionIds": [],
  "exampleIds": [],
  "prerequisiteTopicIds": [],
  "priority": 95,
  "learningStatus": "published",
  "sourceCommit": "a350b576bbeae6c6254273037a17d2a8730fb80f",
  "catalogRootHash": "sha256:0dbfa378eedaaef0b31867b679e7932157eb63bb0cc4e3fa0fb0a0d1869c6518",
  "symbolRootHash": "sha256:52e4461d185ce375263aca5e412b2d93f402d906867bf0940bffc9807eec6297",
  "coverageTargets": [
    "event"
  ],
  "warnings": []
}
