{
  "id": "ncbutton-api",
  "frameworkId": "ncom",
  "type": "component",
  "title": "NCButton API and usage patterns",
  "description": "Learn NCButton public API and event usage.",
  "packageIds": [],
  "symbolIds": [
    "symbol-4ef0a65933001699",
    "symbol-c7b514bbc7b95fb6"
  ],
  "componentIds": [
    "component-6279f9bfe1af1227"
  ],
  "documentSectionIds": [],
  "exampleIds": [],
  "prerequisiteTopicIds": [
    "component-base-model",
    "event-system"
  ],
  "priority": 94,
  "learningStatus": "published",
  "sourceCommit": "a350b576bbeae6c6254273037a17d2a8730fb80f",
  "catalogRootHash": "sha256:0dbfa378eedaaef0b31867b679e7932157eb63bb0cc4e3fa0fb0a0d1869c6518",
  "symbolRootHash": "sha256:52e4461d185ce375263aca5e412b2d93f402d906867bf0940bffc9807eec6297",
  "coverageTargets": [
    "component",
    "public_symbol",
    "example"
  ],
  "warnings": []
}
