{
  "id": "lifecycle-callbacks",
  "frameworkId": "ncom",
  "type": "lifecycle",
  "title": "NCom lifecycle callback structure",
  "description": "Record commit-bound lifecycle callback declarations without inferring runtime order.",
  "packageIds": [],
  "symbolIds": [
    "symbol-fca3708ca106bc60"
  ],
  "componentIds": [],
  "documentSectionIds": [],
  "exampleIds": [],
  "prerequisiteTopicIds": [],
  "priority": 89,
  "learningStatus": "published",
  "sourceCommit": "a350b576bbeae6c6254273037a17d2a8730fb80f",
  "catalogRootHash": "sha256:0dbfa378eedaaef0b31867b679e7932157eb63bb0cc4e3fa0fb0a0d1869c6518",
  "symbolRootHash": "sha256:52e4461d185ce375263aca5e412b2d93f402d906867bf0940bffc9807eec6297",
  "coverageTargets": [
    "lifecycle",
    "public_symbol"
  ],
  "warnings": []
}
